name,name_kana,prefecture,city,category,league,training_area,home_ground,official_site_url,instagram_url,x_url,facebook_url,memo
セレッソ大阪U-15,セレッソオオサカアンダーフィフティーン,大阪府,大阪市,J_YOUTH,高円宮杯U-15プリンスリーグ関西,大阪市内,桜スタジアム周辺,https://www.cerezo.co.jp,https://www.instagram.com/cerezo_osaka_official/,https://x.com/CerezoOsaka_off,,
ガンバ大阪ジュニアユース,ガンバオオサカジュニアユース,大阪府,吹田市,J_YOUTH,高円宮杯U-15プリンスリーグ関西,吹田市内,万博記念競技場周辺,https://www.gamba-osaka.net,,,,
ヴィッセル神戸U-15,ヴィッセルコウベアンダーフィフティーン,兵庫県,神戸市,J_YOUTH,高円宮杯U-15プリンスリーグ関西,神戸市内,,https://www.vissel-kobe.co.jp,,,,
センアーノ神戸ジュニアユース,センアーノコウベジュニアユース,兵庫県,神戸市,CLUB,高円宮杯U-15プリンスリーグ関西,神戸市内,,,,,,
京都サンガF.C.U-15,キョウトサンガエフシーアンダーフィフティーン,京都府,京都市,J_YOUTH,高円宮杯U-15プリンスリーグ関西,京都市内,,https://www.sanga-fc.jp,,,,
FCリップエース,エフシーリップエース,大阪府,大阪市,CLUB,高円宮杯U-15関西リーグ,大阪市内,,,,,,
奈良クラブU-15,ナラクラブアンダーフィフティーン,奈良県,奈良市,J_YOUTH,高円宮杯U-15関西リーグ,奈良市内,,,,,,
レイラック滋賀U-15,レイラックシガアンダーフィフティーン,滋賀県,草津市,J_YOUTH,高円宮杯U-15関西リーグ,草津市内,,,,,,
VEERTIEN FC和歌山,フェルティーンエフシーワカヤマ,和歌山県,和歌山市,CLUB,高円宮杯U-15関西リーグ,和歌山市内,,,,,,
